<!ELEMENT aeropuerto (nombre,vuelos,fecha)>
<!ELEMENT nombre (#PCDATA)>
<!ELEMENT vuelos (vuelo+)>
<!ELEMENT vuelo (diario?,origen,destino,hora-salida,hora-llegada)>
<!ATTLIST vuelo cÃ³digo ID #REQUIRED>
<!ATTLIST vuelo estado ( C | E | R ) "E">
<!ELEMENT diario EMPTY>
<!ELEMENT origen (#PCDATA)>
<!ELEMENT destino (#PCDATA)>
<!ELEMENT hora-salida (#PCDATA)>
<!ELEMENT hora-llegada (#PCDATA)>
<!ELEMENT fecha (#PCDATA)>