<?xml version="1.0" encoding="UTF-8"?>
<!DOCTYPE aeropuerto SYSTEM "Ejercicio6.dtd">
<aeropuerto>
    <nombre>JFK</nombre>
    <vuelos>
    <vuelo código="V22" estado="R">
    <diario />
    <origen>New York</origen>
    <destino>Chicago</destino>
    <hora-salida>9:30</hora-salida>
    <hora-llegada>11:30</hora-llegada>
    </vuelo>
    <vuelo código="V23" estado="C">
    <origen>New York</origen>
    <destino>Miami</destino>
    <hora-salida>10:15</hora-salida>
    <hora-llegada>11:15</hora-llegada>
    </vuelo>
    </vuelos>
    <fecha>20/01/2024</fecha>
</aeropuerto>